Title,Artist,Year,Country,Thumbnail
b'Shipwreck in a Thunderstorm',b'Claude-Joseph Vernet',b'1770',b'FR',https://az334034.vo.msecnd.net/images-9/shipwreck-in-a-thunderstorm-claude-joseph-vernet-1770-2aa5d20b.jpg
b'Archduke Leopold Wilhelm in his Gallery in Brussels',b'David Teniers the Younger',b'1640',b'NL',https://az333960.vo.msecnd.net/images-3/archduke-leopold-wilhelm-in-his-gallery-in-brussels-david-teniers-the-younger-1640-c2b425e9.jpg
b'Italianate Landscape with a River and an Arched Bridge',b'Jan Asselijn',b'1648',b'NL',https://az333959.vo.msecnd.net/images-6/italianate-landscape-with-a-river-and-an-arched-bridge-jan-asselijn-1648-f99881cb.jpg
b'Italian Evening Landscape',b'Nicolaes Pieterszoon Berchem',b'1650',,https://az334034.vo.msecnd.net/images-7/italian-evening-landscape-nicolaes-pieterszoon-berchem-1650-46641f43.jpg
b'The Gallery of Archduke Leopold in Brussels',b'David Teniers the Younger',b'1641',b'NL',https://az334033.vo.msecnd.net/images-8/the-gallery-of-archduke-leopold-in-brussels-david-teniers-the-younger-1641-4ecf4d2a.jpg
